{
  "$schema": "../../schemas/common-formation.schema.json",
  "schemaVersion": 1,
  "law": {
    "gov": "https://he.wikisource.org/wiki/%D7%97%D7%95%D7%A7-%D7%99%D7%A1%D7%95%D7%93:_%D7%94%D7%9E%D7%9E%D7%A9%D7%9C%D7%94",
    "knesset": "https://he.wikisource.org/wiki/%D7%97%D7%95%D7%A7-%D7%99%D7%A1%D7%95%D7%93:_%D7%94%D7%9B%D7%A0%D7%A1%D7%AA",
    "lex": "https://main.knesset.gov.il/About/Lexicon/Pages/formation-government.aspx",
    "elect": "https://he.wikisource.org/wiki/%D7%97%D7%95%D7%A7_%D7%94%D7%91%D7%97%D7%99%D7%A8%D7%95%D7%AA_%D7%9C%D7%9B%D7%A0%D7%A1%D7%AA",
    "prop": "https://he.wikisource.org/wiki/%D7%97%D7%95%D7%A7_%D7%94%D7%91%D7%97%D7%99%D7%A8%D7%95%D7%AA_(%D7%93%D7%A8%D7%9B%D7%99_%D7%AA%D7%A2%D7%9E%D7%95%D7%9C%D7%94)"
  },
  "surplusIntro": "הסכם עודפים הוא הסכם בין שתי רשימות לגבי המושבים שנשארים אחרי החלוקה הראשונה. לפי [[elect|חוק הבחירות לכנסת]], שתי רשימות שחתמו \"ייחשבו לענין חלוקת המנדטים... כרשימה אחת\", בתנאי שכל אחת מהן עברה את אחוז החסימה. ההסכם לא מחייב את הרשימות לשבת יחד בממשלה, ואינו התחייבות קואליציונית.",
  "stepsTitle": "איך נבנית ממשלה, בחמישה צעדים",
  "steps": [
    { "title": "בוחרים.", "html": "רשימה שקיבלה לפחות {{thresholdPct}}% מהקולות הכשרים נכנסת לכנסת, ו-{{totalSeats}} המושבים מתחלקים בין הרשימות שעברו. ([[elect|חוק הבחירות לכנסת, סעיף 81]])" },
    { "title": "התייעצויות.", "html": "בתוך שבעה ימים מפרסום התוצאות, נשיא המדינה מתייעץ עם נציגי הסיעות ומטיל על חבר כנסת שהסכים לכך את התפקיד להרכיב ממשלה. בהתייעצויות כל סיעה אומרת על מי היא ממליצה. ([[gov|חוק-יסוד: הממשלה, סעיף 7]])" },
    { "title": "28 ימים.", "html": "לחבר הכנסת יש 28 ימים להרכיב ממשלה, והנשיא רשאי להאריך אותם בעוד 14 ימים לכל היותר. ([[gov|סעיף 8]], [[lex|לקסיקון הכנסת]])" },
    { "title": "אם הוא לא מצליח.", "html": "בתוך שלושה ימים הנשיא מטיל את התפקיד על חבר כנסת אחר, שמקבל 28 ימים, או מודיע שאינו רואה אפשרות להקים ממשלה. אחר כך רוב חברי הכנסת יכולים לבקש בכתב שהתפקיד יוטל על חבר כנסת מסוים, ולו יש 14 ימים. אם גם זה לא קורה, רואים את הכנסת כאילו התפזרה, והבחירות נערכות ביום שלישי האחרון לפני תום 90 ימים. ([[gov|סעיפים 9 עד 11]])" },
    { "title": "הצבעת אמון.", "html": "הממשלה מתייצבת לפני הכנסת, מציגה את קווי היסוד, את הרכבה ואת חלוקת התפקידים ומבקשת אמון. היא קמה ברגע שהכנסת מביעה בה אמון, ועד אז הממשלה היוצאת ממשיכה לכהן. ([[gov|סעיף 13]], [[lex|לקסיקון הכנסת]])" }
  ],
  "checked": "2026-10-17",
  "checkedNote": "הנוסח נבדק ב-{{checked}} בנוסח המשולב של החוקים בוויקיטקסט ובלקסיקון באתר הכנסת. הנוסח בוויקיטקסט אינו הפרסום הרשמי ברשומות.",
  "glossary": [
    { "term": "גוש", "html": "כינוי לקבוצת רשימות שפועלות יחד או מתכוונות להמליץ על אותו מועמד. זה לא מונח בחוק, והגבולות שלו משתנים. הכלי לא משייך רשימות לגושים." },
    { "term": "אחוז החסימה", "html": "{{thresholdPct}}% מהקולות הכשרים. רשימה שלא הגיעה אליו לא מקבלת מושב. {{thresholdPct}}% מ-{{totalSeats}} הם {{thresholdSeats}} מושבים, ולכן בכלי אפשר להזין 0 או {{minSeats}} ומעלה, ולא 1 עד {{belowMinSeats}}. זה פישוט: החלוקה המדויקת תלויה בכל הקולות." },
    { "term": "הסכם עודפים", "html": "שתי רשימות שנספרות כרשימה אחת רק בחלוקת המושבים שנשארו אחרי החלוקה הראשונה. זה לא הסכם לשבת יחד בממשלה." },
    { "term": "קואליציה ואופוזיציה", "html": "הקואליציה היא הרשימות שחברות בממשלה ותומכות בה בכנסת. האופוזיציה היא כל השאר." },
    { "term": "תמיכה מבחוץ", "html": "רשימה שלא חברה בממשלה ולא מקבלת בה תפקידים, אבל מצביעה בעדה או נמנעת כדי שתקום או תשרוד." },
    { "term": "ממשלת מיעוט", "html": "ממשלה שלקואליציה שלה יש פחות מ-{{majority}} מושבים. [[gov|חוק-יסוד: הממשלה]] לא קובע רוב מיוחד להצבעת האמון, ו[[knesset|חוק-יסוד: הכנסת]] (סעיף 25) קובע שהכנסת מחליטה ברוב המשתתפים בהצבעה, בלי הנמנעים. מכאן שממשלה יכולה לקום גם בלי {{majority}} תומכים. זו קריאה שלנו של שני הסעיפים יחד." },
    { "term": "רוטציה וראש ממשלה חליפי", "html": "ב-2020 נוסף לחוק מנגנון \"ממשלת חילופים\": שני חברי כנסת מכהנים כראש הממשלה בזה אחר זה, והשני מכהן בינתיים כראש ממשלה חליפי. לפי נוסח החוק, הסעיפים האלה יבוטלו מתחילת כהונת הכנסת ה-26{{rotationNote}}. ([[gov|חוק-יסוד: הממשלה, סעיף 13א]])" },
    { "term": "הצבעת אמון", "html": "ההצבעה שבה הכנסת מאשרת ממשלה חדשה. כדי להחליף ממשלה מכהנת, רוב חברי הכנסת ({{majority}}) צריכים להביע אמון בממשלה אחרת. ([[gov|סעיף 28]])" }
  ]
}
